Name,Rating,Review,Clean_Review,Polarity,Sentiment,Review_Length
mohit raj,4.0,"I have been an Android phone user since  ever, until now.The matte frosting on the back is marvelous and doesn't attract fingerprints or smudges.I love the form factor as it's one hand friendly.For better gaming experience users should opt for the plus size.The screen is great with excellent outdoor visibility. The battery life is crazy good especially the standby time. Barely sips anything overnight. I am using an Android fast charger to charge this and the charging time is decent, no is...",i have been an android phone user since ever until nowthe matte frosting on the back is marvelous and doesnt attract fingerprints or smudgesi love the form factor as its one hand friendlyfor better gaming experience users should opt for the plus sizethe screen is great with excellent outdoor visibility the battery life is crazy good especially the standby time barely sips anything overnight i am using an android fast charger to charge this and the charging time is decent no is,0.3597222222222222,Positive,496
Arun Babu,5.0,One year use 90% battery 🪫 health decreased.iam never 👎 updating software upgrades sound quality the best ever camera 📷  outdoor camera quality bestIndoor full darkness handling very well nice weight management,one year use battery health decreasediam never updating software upgrades sound quality the best ever camera outdoor camera quality bestindoor full darkness handling very well nice weight management,0.51,Positive,210
Munish  Choudhary,5.0,Camera is good,camera is good,0.7,Positive,14
Baban Dey,5.0,"Great product,must buy if you are iPhone lovers",great productmust buy if you are iphone lovers,0.8,Positive,47
Flipkart Customer,5.0,Goood phone,goood phone,0.0,Negative,11
shanavas vn,5.0,SUPER12 MINI TO 15 😍😍😍,super mini to,0.3333333333333333,Positive,22
Mohammad Amir,3.0,Design and performance is good. But somehow I felt the quality and standard is not the same as it used to be. It does heat up while charging and prolonged usage. This is unexpected and unacceptable. Also there are connectivity issues with Apple CarPlay.,design and performance is good but somehow i felt the quality and standard is not the same as it used to be it does heat up while charging and prolonged usage this is unexpected and unacceptable also there are connectivity issues with apple carplay,0.19999999999999998,Positive,253
Dr Babu  Mandal,5.0,Marvellous camera. Light weight. Perfect handy.Used every pro version before 15.But trust me . I personally feel this 15 is at par with its pro version camera .,marvellous camera light weight perfect handyused every pro version before but trust me i personally feel this is at par with its pro version camera,0.4666666666666666,Positive,160
Utpal  Mondal,5.0,This is undoubtedly the best in the market! Feels premium and also the performance is at par excellence! A beast in terms of camera quality and battery backup!,this is undoubtedly the best in the market feels premium and also the performance is at par excellence a beast in terms of camera quality and battery backup,1.0,Positive,159
Mohd Siddique,5.0,The colour blue is so good and the battery life is so long as compared to 14 the camera is much better than 14series best phone I experienced very good,the colour blue is so good and the battery life is so long as compared to the camera is much better than series best phone i experienced very good,0.5514285714285715,Positive,151
Shrikant Panigrahi,5.0,Black one is classy. Photos are much better than 13,black one is classy photos are much better than,0.14444444444444446,Positive,51
Anurag Kumar,5.0,Awesome look and feel,awesome look and feel,1.0,Positive,21
Flipkart Customer,5.0,I bought at 53k for my Father.. He really liked the phone. Best phone at this price range.Camera : 5/5Display : 5/5Battery : 4/5Performance : 5/5Only cons is that it still comes with 60Hz display and battery does not last long.,i bought at k for my father he really liked the phone best phone at this price rangecamera display battery performance only cons is that it still comes with hz display and battery does not last long,0.31,Positive,227
Amaresh Panda,5.0,Overall good experience first time with flipkart from buying till delivery. Battery 4.5 and colour wise 4.5 rest all 5 out 5.,overall good experience first time with flipkart from buying till delivery battery and colour wise rest all out,0.4125,Positive,125
A L Naveen Kumar,,"Phone is heating up too much, even after multiple software upgrades, not suggest to buy, please ignore",phone is heating up too much even after multiple software upgrades not suggest to buy please ignore,0.1,Positive,102
Vikash Kumar,4.0,Just luking like a aww,just luking like a aww,0.3,Positive,22
Mithilesh Kumar  Sharma,5.0,Kidney to gyaOne kidney for i phoneAnd one for i phone accessories,kidney to gyaone kidney for i phoneand one for i phone accessories,0.0,Negative,66
ALIM  Khan,5.0,Good over,good over,0.7,Positive,9
Rajiv Bhardwaj,4.0,Bought 2 of them In diwali sale for 58k each.Camera is great. A very good display and performance is good as well. But battery drains very fast and heating issue is there sometimes otherwise it's a great deal,bought of them in diwali sale for k eachcamera is great a very good display and performance is good as well but battery drains very fast and heating issue is there sometimes otherwise its a great deal,0.694,Positive,208
Ravi Gangrale,5.0,Great camera quality 😍😍,great camera quality,0.8,Positive,23
Prasanth Rajendran,5.0,Handy,handy,0.6,Positive,5
Leo Jonas Doyom,5.0,Great deviceThe 60hz is not a big deal like the influencers says that it is.,great devicethe hz is not a big deal like the influencers says that it is,0.4,Positive,76
Flipkart Customer,5.0,Good,good,0.7,Positive,4
Rohit Semwal,5.0,You have to charge it 3 times atleast if you use it as a primary phoneOtherwise the phone is yoo,you have to charge it times atleast if you use it as a primary phoneotherwise the phone is yoo,0.4,Positive,96
Ogam  Tayeng,3.0,"After 4+ months.Cons:1. Still heats eats up a lot!!!2. Wifi connection is very poor in this model, it fails to connect most of the time automatically where I manually need to search and join the wifi and then again it automatically disconnects. I have an iPad air which works fine, maybe it's a range issue.3. My keyboard switches automatically from Microsoft SwiftKey to stock ios keyboard. Idk what's the issue??4. Need to switch to airplane mode after going out from the wifi range otherwi...",after monthscons still heats eats up a lot wifi connection is very poor in this model it fails to connect most of the time automatically where i manually need to search and join the wifi and then again it automatically disconnects i have an ipad air which works fine maybe its a range issue my keyboard switches automatically from microsoft swiftkey to stock ios keyboard idk whats the issue need to switch to airplane mode after going out from the wifi range otherwi,-0.025833333333333333,Negative,495
Flipkart Customer,5.0,superb phone,superb phone,1.0,Positive,12
ATHAR  faisal,3.0,"To,Dear Flipkart Team, I hope this email finds you well. I am writing to bring to your attention an issue I encountered during my recent access to Urly on 25th September 2024 through my Plus membership. On the night of 25th September, I eagerly awaited the bigbillion sale and placed an order for an iPhone 15 using my HDFC credit card. However, despite multiple attempts, the order did not go through. I eventually made the full payment via Google Pay, but noticed discrepancies in the amount ch...",todear flipkart team i hope this email finds you well i am writing to bring to your attention an issue i encountered during my recent access to urly on th september through my plus membership on the night of th september i eagerly awaited the bigbillion sale and placed an order for an iphone using my hdfc credit card however despite multiple attempts the order did not go through i eventually made the full payment via google pay but noticed discrepancies in the amount ch,0.11666666666666665,Positive,499
Charan,3.0,Mobile heats a lot and battery drain fast,mobile heats a lot and battery drain fast,0.2,Positive,41
Vicky  Rathore,5.0,Great purchase and fantastic design and camera. Battery could be better but overall good Phone.,great purchase and fantastic design and camera battery could be better but overall good phone,0.4800000000000001,Positive,95
Abhishek Prajapati,5.0,"All is well, but battery health is draining very fast.",all is well but battery health is draining very fast,0.26,Positive,54
Aravind Ponugoti,5.0,"Perfect upgrade from 13.. An incredible device that delivers everything I could want. The design is sleek and lightweight, with the new Dynamic Island feature. The camera is a standout, photos and videos look professional with excellent low-light performance and vibrant colors.The A16 Bionic chip ensures lightning-fast performance, whether I'm gaming, editing videos, or running multiple apps. Battery life is also impressive, easily lasting a full day with moderate use.",perfect upgrade from an incredible device that delivers everything i could want the design is sleek and lightweight with the new dynamic island feature the camera is a standout photos and videos look professional with excellent lowlight performance and vibrant colorsthe a bionic chip ensures lightningfast performance whether im gaming editing videos or running multiple apps battery life is also impressive easily lasting a full day with moderate use,0.3877525252525252,Positive,473
Flipkart Customer,5.0,Probably best phone to buy under 53kOverall good balanced phoneBeing a ios device it'll never give you the fun of an Android device. Buy only if you want it for professional reasons,probably best phone to buy under koverall good balanced phonebeing a ios device itll never give you the fun of an android device buy only if you want it for professional reasons,0.42000000000000004,Positive,181
Abi Yuvan,5.0,Battery only drain fastBattery health 98 at two monthBut worth,battery only drain fastbattery health at two monthbut worth,0.15,Positive,62
Adhitya Ramakrishnan,5.0,Everything is awesome! Great phone..,everything is awesome great phone,0.9,Positive,36
Atul kumar Soni,5.0,"This is the first time I've purchased iphone and it's great.Performance, speed and the feature is good and new update of the IOS having great feature and customizations in the UI.",this is the first time ive purchased iphone and its greatperformance speed and the feature is good and new update of the ios having great feature and customizations in the ui,0.4715909090909091,Positive,179
Lokesh  Alawa,5.0,good,good,0.7,Positive,4
Madhan Reddy,5.0,No one can beat iphone camera,no one can beat iphone camera,0.0,Negative,29
R K,5.0,Everything is fine but sometimes it unnecessarily heats up.,everything is fine but sometimes it unnecessarily heats up,0.008333333333333331,Negative,59
Chandan Banerjee,5.0,Good quality,good quality,0.7,Positive,12
Flipkart Customer,5.0,Beast in that price range ⚜️🔥,beast in that price range,0.0,Negative,29
Satendra  Singh,5.0,supper,supper,0.0,Negative,6
Sourajyoti  Malakar,5.0,What to say about iphone😂If you have money then buy it.,what to say about iphoneif you have money then buy it,0.0,Negative,55
Annu Tiwari,5.0,Nice productI am buy 2nd next year...,nice producti am buy nd next year,0.3,Positive,37
G Suresh,5.0,Already i have used the i phone 7 plus but now Purchase of i phone 15 that feel really happy and smoothness using the phone,already i have used the i phone plus but now purchase of i phone that feel really happy and smoothness using the phone,0.8,Positive,123
Flipkart Customer,5.0,"Initially I missed 120 Hz screen refresh rate after switching from Mi 11x pro to iphone15. It been a month using iPhone 15, accordingly to my experience, unless you want to purchase more apple products like Mac book, apple watch etc. it is not smart decision to buy iphone. But I surely appreciated it's small form factor and less weight. Battery backup is also good.",initially i missed hz screen refresh rate after switching from mi x pro to iphone it been a month using iphone accordingly to my experience unless you want to purchase more apple products like mac book apple watch etc it is not smart decision to buy iphone but i surely appreciated its small form factor and less weight battery backup is also good,0.1251700680272109,Positive,367
Mohd Hasnain,5.0,"Upgraded from iPhone 11, The camera quality is awesomeThe display quality is great and the dynamic island working perfectlyHappy with Apple and Flipkart",upgraded from iphone the camera quality is awesomethe display quality is great and the dynamic island working perfectlyhappy with apple and flipkart,0.4,Positive,152
Deepanjan Bhattacharjee,5.0,Awesome phone phone by apple 🍎,awesome phone phone by apple,1.0,Positive,30
Venkat Ramana,5.0,Amazing 😍😍😍😍Just go and buy it blindly if you have enough of money,amazing just go and buy it blindly if you have enough of money,0.03333333333333336,Negative,66
Ashbin paul Paul,4.0,"I bought this in big billion days in Flipkart, overall the pho",i bought this in big billion days in flipkart overall the pho,0.0,Negative,62
Megha bodhan,4.0,☺️Awesome must buy it I m really happy with iPhone 15 ❤️😊🥹😍,awesome must buy it i m really happy with iphone,0.9,Positive,59
Manoj negi,4.0,"Phone is good but if u already have an iPhone 12,13,14 then it's not worth upgrading, same design and similar performance except dynamic Island which I guarantee you will ever notice or use",phone is good but if u already have an iphone then its not worth upgrading same design and similar performance except dynamic island which i guarantee you will ever notice or use,0.10999999999999999,Positive,189
Aalok Singh,4.0,Much faster and best camera only issue of battery one day easily use after full charge. Design Awesome 🤘🏻✌️.best color in images and 4K with 60 fps is awesome.,much faster and best camera only issue of battery one day easily use after full charge design awesome best color in images and k with fps is awesome,0.6229166666666667,Positive,159
Shadab Lampsy,4.0,Apple as usual. Eco system is great. Rest all are average for the price but I paid for the ecosystem,apple as usual eco system is great rest all are average for the price but i paid for the ecosystem,0.13333333333333333,Positive,100
Praveen sarwa,4.0,Product is good. But worst delivery experience,product is good but worst delivery experience,-0.15000000000000002,Negative,46
Girish Pal,5.0,Everything is fine but it's heating while using phone 🥲,everything is fine but its heating while using phone,0.4166666666666667,Positive,55
ANAMIKA pandey,,It's battery is not as mentioned.Camera quality is good but sometime it doesn't even work and gives blur picture.,its battery is not as mentionedcamera quality is good but sometime it doesnt even work and gives blur picture,0.7,Positive,113
anujyadav anuj,5.0,Very good product,very good product,0.9099999999999999,Positive,17
Pentakota Pavan,5.0,Everything is good. Battery backup is hardly 6hrs will come while continuously usage. Camera is fantastic. In this iphone 60 hz refreshing rate is equals to 120hz refresh rate in android. Very light weight.,everything is good battery backup is hardly hrs will come while continuously usage camera is fantastic in this iphone hz refreshing rate is equals to hz refresh rate in android very light weight,0.3656666666666667,Positive,206
Tekchand Biswal,5.0,Nice product. The look of the phone is awesome 👌. Great to have the iphone black color.,nice product the look of the phone is awesome great to have the iphone black color,0.5583333333333335,Positive,87
Flipkart Customer,3.0,Camera very hard but phone heating 😒😒,camera very hard but phone heating,-0.3791666666666667,Negative,37
R H,,Battery backup is not at all good,battery backup is not at all good,0.7,Positive,33
Abhinav Singh negi,5.0,Nice phone,nice phone,0.6,Positive,10
Flipkart Customer,5.0,Awesome picture qualityLoved it😍,awesome picture qualityloved it,1.0,Positive,32
Ronju miya,5.0,Very genuine product. Camera is outstanding as well as performance,very genuine product camera is outstanding as well as performance,0.51,Positive,66
Jishnu  Samanta,5.0,"I recently purchased the iPhone 15 from Flipkart, and I'm thrilled with my experience. The sleek design and vibrant display are stunning, and the performance is top-notch with its powerful A16 Bionic chip. The camera quality is exceptional, capturing detailed and vivid photos even in low light. Battery life has been impressive, easily lasting a full day with heavy use. Flipkart's delivery was prompt, and the packaging was secure. Overall, I'm extremely satisfied with my purchase and would hig...",i recently purchased the iphone from flipkart and im thrilled with my experience the sleek design and vibrant display are stunning and the performance is topnotch with its powerful a bionic chip the camera quality is exceptional capturing detailed and vivid photos even in low light battery life has been impressive easily lasting a full day with heavy use flipkarts delivery was prompt and the packaging was secure overall im extremely satisfied with my purchase and would hig,0.3063725490196078,Positive,500
Amiya Roy,5.0,"Upgraded from Iphone 11. worth buying it. here are some pros and cons.Pros:1) Smooth, constant software update,2)6 GB RAM,1 day easily sustainable battery life3) extremely helpful if you are in apple ecosystem.4) 48MP camera is really great if we compare  with my I Phone 11's 12 MP .Best video quality.5) don't go for 15 plus or pro model even if you have enough money. but 128 GB base model within 65000 RS and use that extra money to buy MacBook AIR or airpod 3rd GEN.CONS:1) 60HZ disp...",upgraded from iphone worth buying it here are some pros and conspros smooth constant software update gb ram day easily sustainable battery life extremely helpful if you are in apple ecosystem mp camera is really great if we compare with my i phone s mp best video quality dont go for plus or pro model even if you have enough money but gb base model within rs and use that extra money to buy macbook air or airpod rd gencons hz disp,0.20083333333333336,Positive,491
Aryan sharma,5.0,I just upgraded from an old android device to this .. the overall experience is Insane,i just upgraded from an old android device to this the overall experience is insane,-0.3,Negative,86
Ashis Karamakar,5.0,Excellent product,excellent product,1.0,Positive,17
Atul Rasyal,5.0,The product is good.Prize is excessive due to Apple branding only. Battery backup is not up to expectations. Flagship Titanium is lacking in it which is available in pro models only. At this price the screen should have been 6.8 inches at least.,the product is goodprize is excessive due to apple branding only battery backup is not up to expectations flagship titanium is lacking in it which is available in pro models only at this price the screen should have been inches at least,-0.04583333333333333,Negative,245
SUMIT LOHIA,5.0,Click the pic is amazing.,click the pic is amazing,0.6000000000000001,Positive,25
Rahul Banerjee,5.0,Awesome.Camera too goodDisplay too goodBattery GoodFeels too good,awesomecamera too gooddisplay too goodbattery goodfeels too good,0.7,Positive,65
Mahipal Gariya,4.0,"Perfect one to upgradeEdit after 7 months : No diappointments , build quality good as this has undergone few hard falls . Underwater also good . Camera quality is awesome . Battery is always a issue but it is okay for a person uses 5-6 hours daily . Videos are also good in cinematic mode . Good update i bought it at 78k when launched . But Around 65 it is super deal to do at this time .",perfect one to upgradeedit after months no diappointments build quality good as this has undergone few hard falls underwater also good camera quality is awesome battery is always a issue but it is okay for a person uses hours daily videos are also good in cinematic mode good update i bought it at k when launched but around it is super deal to do at this time,0.4284722222222222,Positive,389
Bijoy Chakraborty,5.0,Bumper mobile..,bumper mobile,0.0,Negative,15
Yash,5.0,Black colour is just awesome 🔥🔥,black colour is just awesome,0.4166666666666667,Positive,31
MD Arbaaz patel,5.0,"Its first iPhone of my life, excellent performance, camera and display.Battery is good last for 5 hours to 6 house in daily uses.",its first iphone of my life excellent performance camera and displaybattery is good last for hours to house in daily uses,0.39,Positive,129
Zubair Khan,5.0,I am very happy with the sevice of Flipkart and  product was very good.thanks Flipkart,i am very happy with the sevice of flipkart and product was very goodthanks flipkart,0.6,Positive,86
Rishi Raj,5.0,All and all a beast!!!🔥💯The only thing which can be improved is battery 😕,all and all a beastthe only thing which can be improved is battery,0.0,Negative,73
Teddy Bear,5.0,Recently bought this phone and realized why Apple make the best phones in the world.One of the most beautiful purchase I ever made 💙,recently bought this phone and realized why apple make the best phones in the worldone of the most beautiful purchase i ever made,0.5875,Positive,132
Deb Neogi,5.0,"At the time of sale it was the best deal for me , intented to buy pixel 8 but went for iphone 15 was really worth it . Performance user experience camera design is undoubtedly excellent the only drawback is the battery life , which sustains for only 6 7 hours and in daily life have to charge 2 times . As a flagship phone it could be a better but noting is perfect, without the battery issue in every aspect it is value for money.",at the time of sale it was the best deal for me intented to buy pixel but went for iphone was really worth it performance user experience camera design is undoubtedly excellent the only drawback is the battery life which sustains for only hours and in daily life have to charge times as a flagship phone it could be a better but noting is perfect without the battery issue in every aspect it is value for money,0.475,Positive,431
Flipkart Customer,5.0,"In 51500, it's the best option",in its the best option,1.0,Positive,30
Prajwal Suryan,5.0,"Awesome phone, camera✅, build✅, battery lasts 1 day easily✅, overall met my expectations😊",awesome phone camera build battery lasts day easily overall met my expectations,0.5,Positive,89
John Fanai,5.0,"Awesome 🫰As a first time ios user, I literally think it's one of the best deal!Nonetheless as Android-flagship becoming more expensive these days, still ios doesn't match the fluidity provided by Android. One very promising I've seen so far using iPhone is that battery last longer than i expected with high security. It's like pay per view authenticity one can appreciate using iPhone. If you can match the trend set in ios you may go for it but if you don't stick with your android. People m...",awesome as a first time ios user i literally think its one of the best dealnonetheless as androidflagship becoming more expensive these days still ios doesnt match the fluidity provided by android one very promising ive seen so far using iphone is that battery last longer than i expected with high security its like pay per view authenticity one can appreciate using iphone if you can match the trend set in ios you may go for it but if you dont stick with your android people m,0.28363636363636363,Positive,496
Flipkart Customer,5.0,Phone is good but during video shooting in summer phone is heated too much,phone is good but during video shooting in summer phone is heated too much,0.44999999999999996,Positive,74
Ranjith kumar,5.0,"Bought 256gb green variant 😍,new to iosIOS is very fluid and smoothDesign is awesome, i took green its looking better in hand than other colours and dynmaic island adds to it.No heatings issuesPerfromance is goodCharges faster than pixelCamera and Video recording is very goodComing from pixel 7a where pixel is one of worst device out there having bad charging, worst battery backup even heats up in normal usage in our country.",bought gb green variant new to iosios is very fluid and smoothdesign is awesome i took green its looking better in hand than other colours and dynmaic island adds to itno heatings issuesperfromance is goodcharges faster than pixelcamera and video recording is very goodcoming from pixel a where pixel is one of worst device out there having bad charging worst battery backup even heats up in normal usage in our country,-0.10321969696969698,Negative,429
Rahul Yadav,5.0,Good 👍,good,0.7,Positive,6
Diwakar Mahato,5.0,This is my first iPhone. Experience is very good as of now. For me I have to work with excel and word most of the time and there is no MS office because iPhone has its own version of Office which is a bit different.Camera and battery both are good. Look is so premium.,this is my first iphone experience is very good as of now for me i have to work with excel and word most of the time and there is no ms office because iphone has its own version of office which is a bit differentcamera and battery both are good look is so premium,0.592,Positive,268
Tushar Sankhe,5.0,The person to whom it's gifted says that everything is  great. Hope it was a little cheaper and more affordable.,the person to whom its gifted says that everything is great hope it was a little cheaper and more affordable,0.403125,Positive,112
Abhishek Bhatia,5.0,I love the product 😍 and the delivery person also and adding camera photos,i love the product and the delivery person also and adding camera photos,0.5,Positive,74
