Name,Rating,Review,Clean_Review,Polarity,Sentiment,Review_Length
Flipkart Customer,5.0,Just go for it 🫠,just go for it,0.0,Negative,16
Rohan singh rajput,5.0,Camera and display both are good 😍,camera and display both are good,0.7,Positive,34
Golam Masud,5.0,iPhone 13 update to iPhone 15,iphone update to iphone,0.0,Negative,29
Pravin Darekar,5.0,Except screen refresh rate everything is good.,except screen refresh rate everything is good,0.7,Positive,46
Battula Asha,5.0,Amazing 👌,amazing,0.6000000000000001,Positive,9
Flipkart Customer,4.0,Good product ￼,good product,0.7,Positive,14
Piyush Jaiswal,5.0,Best I phone 15,best i phone,1.0,Positive,15
Sakshi Patil,5.0,"Iphone 15 is best ever and it's appearance,keypad is so good I like it much!!As we see in online photos back CLR was  dark but after you handled it it's in the light green colour nd I love that colour.",iphone is best ever and its appearancekeypad is so good i like it muchas we see in online photos back clr was dark but after you handled it its in the light green colour nd i love that colour,0.32142857142857145,Positive,201
Suman Lama,5.0,Very nice phone the camera was too good I luv it,very nice phone the camera was too good i luv it,0.74,Positive,48
Abhi Srivastava,5.0,Fast Reliable Beautiful,fast reliable beautiful,0.525,Positive,23
Mayur Mahajan,5.0,It's good to be transfer iphone 11 to 15 and best experience ever.,its good to be transfer iphone to and best experience ever,0.85,Positive,66
raj  khan,5.0,Fabulous!!!,fabulous,0.4,Positive,11
Navin Srivastava,5.0,Camera is a major upgrade over previous models. If you have 12 or older you can upgrade to 15 without thinking,camera is a major upgrade over previous models if you have or older you can upgrade to without thinking,0.020833333333333332,Negative,110
Ajay G,5.0,"Back to iPhone family from android, best upgrade phone. Fully satisfied with the design and the performance. Minimum 10hrs of battery on single charge (12hrs in low power mode). No lags and even it charges very fast up to 80% which is decent.",back to iphone family from android best upgrade phone fully satisfied with the design and the performance minimum hrs of battery on single charge hrs in low power mode no lags and even it charges very fast up to which is decent,0.2650340136054422,Positive,242
Sagar Dhiryan,5.0,"Great phone , worth the money",great phone worth the money,0.55,Positive,29
Rohit Kumar Mishra,5.0,Nice iPhone,nice iphone,0.6,Positive,11
Harit Madan,4.0,Battery Health Dropped to 85% in 6 months. Rest everything is ok.,battery health dropped to in months rest everything is ok,0.5,Positive,65
Zeyarul Sk,4.0,"The phone is pretty good in terms of camera.  However, those who have used 120hz premium display phones will find the display experience to be bad.",the phone is pretty good in terms of camera however those who have used hz premium display phones will find the display experience to be bad,0.08333333333333337,Negative,147
Rahul P,4.0,Best in the budget,best in the budget,1.0,Positive,18
Flipkart Customer,5.0,Product is good as you all know its iphone,product is good as you all know its iphone,0.7,Positive,42
Shikha Srivastava,4.0,Awesome pics by iphone 15. Love it😍😍,awesome pics by iphone love it,0.75,Positive,36
Vinayraje Urs,4.0,Heating issue but overall good phone,heating issue but overall good phone,0.35,Positive,36
Narasmhamvenkata Bikkavilli,4.0,Overall good,overall good,0.35,Positive,12
ANUBHAV  CHAUHAN,4.0,Nice product but the heating issue n battery can be improved,nice product but the heating issue n battery can be improved,0.6,Positive,60
Amardeep Raghwani,5.0,Awesome phone 📱,awesome phone,1.0,Positive,15
Harpreet Singh,5.0,v v good,v v good,0.7,Positive,8
Mayank Varshney,5.0,"Nice camera first of all then battery is also very decent although the Mah is low but the optimisation of phone is very good with the battery so handy and classy ,also the calling quality and speakers are too good.",nice camera first of all then battery is also very decent although the mah is low but the optimisation of phone is very good with the battery so handy and classy also the calling quality and speakers are too good,0.42208333333333337,Positive,214
Shekar Dhongdi,5.0,"Thanks flipkart for the on time delivery. About the product it's a minor upgrade from 13 and 14... except dynamic island and 48mp camera, of course not to forget 4nm A16 chipset which is a plus",thanks flipkart for the on time delivery about the product its a minor upgrade from and except dynamic island and mp camera of course not to forget nm a chipset which is a plus,0.05000000000000001,Negative,193
Soumen Biswas,5.0,Awesome 🥰,awesome,1.0,Positive,9
Dulamani Pranaya  Patel,5.0,"I'm very excited to this, Apple iPhone 15And this is my first Apple devices!Value for money ✔️TQ so much for your valuable cooperation FlipkartDelivery within 24 hrs only",im very excited to this apple iphone and this is my first apple devicesvalue for money tq so much for your valuable cooperation flipkartdelivery within hrs only,0.234375,Positive,170
Sidhart Lal,5.0,Exclusive product from Apple. Thanks To Flipkart for fast delivery,exclusive product from apple thanks to flipkart for fast delivery,0.2,Positive,66
Pawan Kumar,5.0,"I am happy with this iphone 15. Battery,Display are best and camera also",i am happy with this iphone batterydisplay are best and camera also,0.9,Positive,72
Sreenivas Vadde,5.0,My dream comes true,my dream comes true,0.35,Positive,19
Raj Vk,5.0,Superb,superb,1.0,Positive,6
Rohith cherry Reddy,5.0,Good and super performance loved it but not happy with the delivery its been late for 2days rest all went good n awesome product,good and super performance loved it but not happy with the delivery its been late for days rest all went good n awesome product,0.3904761904761904,Positive,128
Vivek Rawat,5.0,Smooth 🔥,smooth,0.4,Positive,8
Flipkart Customer,4.0,"As always, Apple doing its job perfectly! Superb Phone!",as always apple doing its job perfectly superb phone,1.0,Positive,55
Hitesh  Mahajan,5.0,"Overall: The iPhone 15 is a fantastic phone for everyday use, it offers a compelling blend of performance, camera prowess (no doubt the best camera), and battery life (as per my use it is easily lasting 1 full day). However, the lack of a high refresh rate display and the underwhelming charging speed hold it back from being truly exceptional.Pros:Superb Cameras: The 48MP main sensor captures stunning photos with excellent detail and dynamic range. Low-light performance is also impressive. ...",overall the iphone is a fantastic phone for everyday use it offers a compelling blend of performance camera prowess no doubt the best camera and battery life as per my use it is easily lasting full day however the lack of a high refresh rate display and the underwhelming charging speed hold it back from being truly exceptionalprossuperb cameras the mp main sensor captures stunning photos with excellent detail and dynamic range lowlight performance is also impressive,0.3184444444444445,Positive,497
Shasi Krishna,5.0,Superb Performance ✨,superb performance,1.0,Positive,20
Vikas Rana,4.0,Okay,okay,0.5,Positive,4
Shiraz Lone,4.0,"Pros: The phone is excellent in Performance, design, Camera, Battery.  Amazing phoneCones:  The only thing which should have been given is fast charging",pros the phone is excellent in performance design camera battery amazing phonecones the only thing which should have been given is fast charging,0.45,Positive,152
Madan Raj,3.0,Selfie camera worstNot statisfied,selfie camera worstnot statisfied,0.0,Negative,33
Pritesh Saha,3.0,"It ticks all the basic boxes well as expected. But had a lot of expectations from the camera as it was one of the primary reasons for buying iPhone. I can tell you - just go with a Samsung if you want to click photos without thinking too much.The iPhone's camera is not good for Indian human subjects with darker skin tones. It over-processes the image way too much and makes you look much darker than you are. Not just human subjects, it overprocesses everything. The final image looks very dif...",it ticks all the basic boxes well as expected but had a lot of expectations from the camera as it was one of the primary reasons for buying iphone i can tell you just go with a samsung if you want to click photos without thinking too muchthe iphones camera is not good for indian human subjects with darker skin tones it overprocesses the image way too much and makes you look much darker than you are not just human subjects it overprocesses everything the final image looks very dif,0.05500000000000001,Negative,498
Priyanshu  Pandey,4.0,"Pros:Battery LifeThermal managementBody designRAM ManagementCons:iOS - Unpractical, too buggy and least automated",prosbattery lifethermal managementbody designram managementconsios unpractical too buggy and least automated,-0.3,Negative,113
TAHA Khan,5.0,The divice is very heating problem,the divice is very heating problem,0.2,Positive,34
Bharat Aneja,4.0,"iPhone 15 is good, picture quality are also good but phone is heat up",iphone is good picture quality are also good but phone is heat up,0.7,Positive,69
Kotha Parameshwar  Reddy,5.0,Very smooth and nice Phone and thanks to flipkart,very smooth and nice phone and thanks to flipkart,0.44,Positive,49
Abhishek patel,5.0,"I bought this iphone 15 in bbd sale 2024Camera - 5/5Battery - Better then other iphones 5/5Display - AwesomePerformance - A little performance drop when used in sunlight but otherwise performs wellOverall - It is a all rounder phone for gaming, camera, battery, looks and allBest part - It works seamlessly in my apply ecosystem with my mac and ipadThanks to apple and flipkart",i bought this iphone in bbd sale camera battery better then other iphones display awesomeperformance a little performance drop when used in sunlight but otherwise performs welloverall it is a all rounder phone for gaming camera battery looks and allbest part it works seamlessly in my apply ecosystem with my mac and ipadthanks to apple and flipkart,0.071875,Negative,377
Hari Krishnan,4.0,Timely fast delivery by flipcart.Product wise it was just superb ... new design with matt finish and the camaras are just outstanding .,timely fast delivery by flipcartproduct wise it was just superb new design with matt finish and the camaras are just outstanding,0.5072727272727272,Positive,135
Goni  Tomar,,So much heating issue  so much means so much,so much heating issue so much means so much,0.20000000000000004,Positive,44
Tarif Hussain,5.0,"Iphone tremendous perfonce, lovely design..... The Best phone❤️",iphone tremendous perfonce lovely design the best phone,0.611111111111111,Positive,63
Sujan  Roy,5.0,"Good Phone, Nice Design. Love this Phone .",good phone nice design love this phone,0.6,Positive,42
Jeffin Jacob Paul,5.0,"The best iphone to buy right now. Chose the 512 gb variant. It has type c, great battery life and overall great size as well. Thought of getting the plus but it was too big. But that does have good battery life. But this one has a great battery life even with a small battery. Also no words to say about camera and performance. Great absolutely beautiful. I went for the 512 gb storage because this uses more space for photos with the new 48 mp camera. Iphone should really make the base variant a...",the best iphone to buy right now chose the gb variant it has type c great battery life and overall great size as well thought of getting the plus but it was too big but that does have good battery life but this one has a great battery life even with a small battery also no words to say about camera and performance great absolutely beautiful i went for the gb storage because this uses more space for photos with the new mp camera iphone should really make the base variant a,0.3881385281385281,Positive,500
Rechal Clinton Lal,5.0,Amazing product I have upgrade from iPhone 12 to iPhone 15 and it is just incredible. Battery performance also improved a lot .. 🤩,amazing product i have upgrade from iphone to iphone and it is just incredible battery performance also improved a lot,0.75,Positive,130
Ibnemasud  Dabu,5.0,I am so happy 👌👌👌👌👌👌👌👌,i am so happy,0.8,Positive,22
AMRESH KANUJIA,4.0,Over-all best in phone,overall best in phone,0.5,Positive,22
Amit  Jain,5.0,"Best phone ever, Excellent Camera Quality, Everything is Perfect",best phone ever excellent camera quality everything is perfect,1.0,Positive,64
Adhishwar Mishra,5.0,Camera 5/5Display 5/5Battery 4/5Design 5/5Totally happy ❤️,camera display battery design totally happy,0.8,Positive,58
Devendra Singh,5.0,TRUE AND REAL PRODUCT I GOT FROM FLIPKARTTHANKS FLIPKART.,true and real product i got from flipkartthanks flipkart,0.275,Positive,57
Rajesh Kumar,5.0,Simply AWESOME 😍,simply awesome,1.0,Positive,16
Srinivas Kannan,5.0,"Undoubtedly, best phone for the next few years to come !!Flipkart has given the best buyback price so far for me on whatever iPhones I have purchased.",undoubtedly best phone for the next few years to come flipkart has given the best buyback price so far for me on whatever iphones i have purchased,0.38,Positive,150
Bharat Raj Rohidas,5.0,Awesome camera,awesome camera,1.0,Positive,14
Narayan  Sharma,3.0,Heating issue,heating issue,0.0,Negative,13
Nitheesh  P N,5.0,Superb.....,superb,1.0,Positive,11
Ashok kumar,5.0,Great phone but still missing 90hz refresh rate display!,great phone but still missing hz refresh rate display,0.30000000000000004,Positive,56
Gopa B,5.0,Camera quality is very good,camera quality is very good,0.9099999999999999,Positive,27
Flipkart Customer,5.0,"Nyz phone ,Good battery backup.Overall value for money🙌.",nyz phone good battery backupoverall value for money,0.7,Positive,56
sufiyan kansara,5.0,Love to use iphone. Excellent product,love to use iphone excellent product,0.75,Positive,37
